{
  "snapshot_format_version": "1.0.0",
  "snapshot_id": "77777777-7777-4777-8777-777777777777",
  "captured_at": "2026-09-15T10:00:05Z",
  "sources": [
    {
      "source_type": "project",
      "uri": "glomancy://project/example",
      "revision": "project-r1"
    },
    {
      "source_type": "asset",
      "uri": "glomancy://asset/example-selected-object",
      "revision": "asset-r4"
    },
    {
      "source_type": "memory",
      "uri": "glomancy://memory/example-project-note"
    }
  ]
}
